title,rating,number_of_reviews,bought_in_last_month,current/discounted_price,price_on_variant,listed_price,is_best_seller,is_sponsored,is_couponed,delivery_details,sustainability_badges,collected_at,coupon_amount,delivery_cost,est_delivery_date,is_free_delivery,has_fast_delivery,fastest_delivery_date,delivery_weekday,main_sustainability_badge,extra_badges_count
"Duracell - CopperTop AA Alkaline Batteries - Long Lasting, All-Purpose Double A Battery for Household and Business, 4 Batteries, Power Remotes, Toys, and More, Reliable and Trustworthy",4.8,8085,30000,4.97,0.0,6.59,False,False,No Coupon,"Delivery Mon, Sep 1",None,2025-08-21 11:16:50,0,0.0,2025-09-01,False,False,,Mon,None,0
"TP-Link AXE5400 Tri-Band WiFi 6E Router (Archer AXE75)- Gigabit Wireless Internet for Gaming, VPN, OneMesh, WPA3",4.3,4388,6000,149.99,139.88,199.99,False,False,Save $18.00  with coupon,"Delivery Mon, Sep 1",Works with Alexa,2025-08-21 11:16:50,$18.00,0.0,2025-09-01,False,False,,Mon,Works with Alexa,0
"Canon PG-275 Genuine Black Ink Cartridge, Compatible with TS3520/3522, TR4720/4722, TS3720/3722",4.6,12469,10000,16.99,0.0,17.99,False,False,No Coupon,"Delivery Mon, Sep 1",None,2025-08-21 11:16:50,0,0.0,2025-09-01,False,False,,Mon,None,0
"Skullcandy Jib Wired Earbuds with 3.5mm Plug, Noise Isolating Fit, Built-In Microphone Call and Track Control, Convenient for Travel - Black",4.4,16532,10000,7.41,0.0,9.99,False,False,No Coupon,Delivery Aug 29 - Sep 2,None,2025-08-21 11:16:50,0,0.0,2025-08-29,False,False,,,None,0
"HP 65XL Black High-yield Ink Cartridge for HP Printers | Works with Printer Series: AMP 100, DeskJet 2600, 3700; ENVY 5000 | Eligible for Instant Ink | N9K04AN",4.7,28920,10000,,45.89,0.0,False,False,No Coupon,,Manufacturing practices,2025-08-21 11:16:50,0,0.0,,False,False,,,Manufacturing practices,0
"DJI Osmo Mobile SE, 3-Axis Phone Gimbal for iPhone, Android, Built-in Tripod, Selfie Stick, Gimbal Stabilizer for iphone, Andriod, ActiveTrack 6.0, Vlogging Stabilizer for Youtube, TikTok, Travel",4.5,10065,8000,65.0,57.93,69.0,True,False,No Coupon,"Delivery Mon, Sep 1",None,2025-08-21 11:16:50,0,0.0,2025-09-01,False,False,,Mon,None,0
"ASUS The SFF-Ready Prime GeForce RTX™ 5070 12GB GDDR7 Graphics Card (PCIe® 5.0, 12GB GDDR7, HDMI®/DP 2.1, 2.5-Slot, Axial-tech Fans, Dual BIOS)",4.6,1228,2000,549.99,0.0,609.99,False,False,No Coupon,"Delivery Mon, Sep 1",None,2025-08-21 11:16:50,0,0.0,2025-09-01,False,False,,Mon,None,0
"Soundcore P30i by Anker Noise Cancelling Earbuds, Strong and Smart Noise Cancelling, Powerful Bass, 45H Playtime, 2-in-1 Case and Phone Stand, IP54, Wireless Earbuds, Bluetooth 5.4 (Black)",4.4,11806,10000,,25.07,0.0,False,False,No Coupon,,Carbon impact,2025-08-21 11:16:50,0,0.0,,False,False,,,Carbon impact,0
"HP 414A Yellow Toner Cartridge | Works with HP Color LaserJet Enterprise M455dn, MFP M480f; HP Color LaserJet Pro M454 Series, HP Color LaserJet Pro MFP M479 Series | W2022A",4.8,2169,4000,,150.89,0.0,False,False,No Coupon,,None,2025-08-21 11:16:50,0,0.0,,False,False,,,None,0
"Texas Instruments BA II Plus Financial Calculator, Black Medium",4.6,21257,7000,32.99,26.99,41.81,True,False,No Coupon,"Delivery Mon, Sep 1",None,2025-08-21 11:16:50,0,0.0,2025-09-01,False,False,,Mon,None,0
CORSAIR VENGEANCE LPX DDR4 RAM 32GB (2x16GB) 3200MHz CL16-20-20-38 1.35V Intel AMD Desktop Computer Memory - Black (CMK32GX4M2E3200C16),4.8,17000,7000,78.99,0.0,88.99,True,False,No Coupon,"Delivery Mon, Sep 1",None,2025-08-21 11:16:50,0,0.0,2025-09-01,False,False,,Mon,None,0
"Brother HL-L2460DW Wireless Compact Monochrome Laser Printer with Duplex, Mobile Printing, Black & White Output | Includes Refresh Subscription Trial(1), Works with Alexa",4.1,1742,4000,179.99,0.0,0.0,False,False,No Coupon,"Delivery Mon, Sep 1",Works with Alexa,2025-08-21 11:16:50,0,0.0,2025-09-01,False,False,,Mon,Works with Alexa,0
"NETGEAR Nighthawk Modem Router Combo (CAX30) DOCSIS 3.1 Cable Modem and WiFi 6 Router - AX2700 2.7 Gbps - Compatible with Xfinity, Spectrum, Cox, and More - Gigabit Wireless Internet",4.4,743,4000,,179.0,0.0,True,False,No Coupon,,None,2025-08-21 11:16:50,0,0.0,,False,False,,,None,0
"HP 218X Black High-Yield Toner Cartridge | Works with Color Laserjet Pro 3201, MFP 3301 Series | W2180X",4.7,297,5000,112.99,0.0,0.0,False,False,No Coupon,"Delivery Mon, Sep 1",None,2025-08-21 11:16:50,0,0.0,2025-09-01,False,False,,Mon,None,0
"Dell 27 Plus 4K Monitor - S2725QS - 27-inch 4K (3840 x 2160) 120Hz 16:9 Display, IPS Panel, AMD FreeSync Premium, sRGB 99%, Integrated Speakers, 1500:1 Contrast Ratio, Comfortview Plus - Ash White",4.3,423,3000,,246.52,0.0,False,False,No Coupon,,None,2025-08-21 11:16:50,0,0.0,,False,False,,,None,0
JBL Charge 4 - Waterproof Portable Bluetooth Speaker - Black,4.7,56528,5000,,109.95,0.0,False,False,No Coupon,,None,2025-08-21 11:16:50,0,0.0,,False,False,,,None,0
"Fujifilm INSTAX Mini Instant Film 2 Pack = 20 Sheets (White) for Fujifilm Mini 8 & Mini 9 Cameras, Model:4332059078",4.7,27637,10000,24.48,21.59,29.99,False,False,No Coupon,"Delivery Mon, Sep 1",None,2025-08-21 11:16:50,0,0.0,2025-09-01,False,False,,Mon,None,0
"Pendaflex File Folders, Letter Size, 1/3 Cut, Manila, 250 per Box (752250)",4.8,4725,9000,26.5,24.44,29.73,False,False,No Coupon,"Delivery Mon, Sep 1",None,2025-08-21 11:16:50,0,0.0,2025-09-01,False,False,,Mon,None,0
Apple USB-C to Lightning Cable (2 m),4.7,6753,10000,,19.66,0.0,False,False,No Coupon,,None,2025-08-21 11:16:50,0,0.0,,False,False,,,None,0
"Sanus Height Adjustable Speaker Stand for Sonos Era 300™ - 17"" Height Adjustment Sonos Stand Includes Carpet Spikes & Rubber Pads - Easy DIY Install Comes w/All Hardware - White",4.4,45,0,179.99,0.0,0.0,False,True,No Coupon,"Delivery Mon, Sep 1",None,2025-08-21 11:17:26,0,0.0,2025-09-01,False,False,,Mon,None,0
"KODAK 10.1 Inch WiFi Digital Picture Frame,1280x800 HD IPS Touch Screen, Electronic Smart Photo Frame with 32 GB Memory, Auto-Rotate, Instantly Share Photos/Videos Anywhere",4.1,264,0,85.99,0.0,0.0,False,True,Save $16.00  with coupon,"Delivery Mon, Sep 1",None,2025-08-21 11:17:26,$16.00,0.0,2025-09-01,False,False,,Mon,None,0
"Peak Design Slide Lite Camera Strap, Black, Configurable as a Sling, Neck or Shoulder Strap, Quick Release and Connection, Smooth and Grippy Side, Camera Straps for Photographers, 200 lb Capacity",4.7,7235,500,69.95,0.0,0.0,False,True,No Coupon,"Delivery Mon, Sep 1",Small Business,2025-08-21 11:17:26,0,0.0,2025-09-01,False,False,,Mon,Small Business,0
Apple MagSafe Charger (1 m): Wireless Charger with Fast-Charging Capability,4.5,3060,10000,,28.49,0.0,False,False,No Coupon,,None,2025-08-21 11:17:26,0,0.0,,False,False,,,None,0
"Dell Inspiron Touchscreen Laptop, 15.6"" Business & Student Laptop Computer, Windows 11 Pro Laptop 32GB RAM 1TB SSD, Intel i5-1155G7 Processor, Full HD IPS Display, Numeric Keypad, HDMI, Carbon Black",4.2,647,2000,523.99,0.0,0.0,False,False,No Coupon,"Delivery Mon, Sep 1",None,2025-08-21 11:17:26,0,0.0,2025-09-01,False,False,,Mon,None,0
"Amazon Basics 8-Pack Rechargeable AA NiMH Batteries, 2000 mAh, 1.2V, Recharge up to 1000x Times, Pre-Charged",4.4,167901,10000,9.83,8.83,11.22,False,False,No Coupon,"Delivery Mon, Sep 1",None,2025-08-21 11:17:26,0,0.0,2025-09-01,False,False,,Mon,None,0
"Logitech ERGO K860 Wireless Ergonomic Keyboard - Split Keyboard, Wrist Rest, Natural Typing, Stain-Resistant Fabric, Bluetooth and USB Connectivity, Compatible with Windows/Mac, Black",4.5,7601,4000,,105.26,0.0,False,False,No Coupon,,None,2025-08-21 11:17:26,0,0.0,,False,False,,,None,0
"HP 62XL Tri-color High-yield Ink Cartridge | Works with Printer Series: ENVY 5540, 5640, 5660, 7640; OfficeJet 5740, 8040; OfficeJet Mobile 200, 250 | Eligible for Instant Ink | C2P07AN",4.7,17227,7000,,64.89,0.0,False,False,No Coupon,,Manufacturing practices,2025-08-21 11:17:26,0,0.0,,False,False,,,Manufacturing practices,0
"SAMSUNG 32-Inch Class Full HD F6000 Smart TV (2025 Model) HDR, Object Tracking Sound Lite, Knox Security, One UI Tizen, Smart TV",4.3,590,4000,177.99,152.42,0.0,False,False,No Coupon,"Delivery Mon, Sep 1",None,2025-08-21 11:17:26,0,0.0,2025-09-01,False,False,,Mon,None,0
"Xbox Elite Series 2 Core Wireless Gaming Controller – Black – Xbox Series X|S, Xbox One, Windows PC, Android, and iOS",4.3,44602,0,,0.0,0.0,False,False,No Coupon,,None,2025-08-21 11:17:26,0,0.0,,False,False,,,None,0
"Energizer D Batteries, D Cell Battery Premium Alkaline, 8 Count",4.8,27900,10000,14.97,0.0,19.98,False,False,No Coupon,"Delivery Mon, Sep 1",None,2025-08-21 11:17:26,0,0.0,2025-09-01,False,False,,Mon,None,0
"Canon PG-243 / CL-244 Genuine Ink Value Pack (2 Cartridges), Compatible with iP2820, MX492, MG2420/2520/2920/2922/2924/3020/2522/2525, TS3120/302/302a/202/4520/3320",4.6,69726,9000,33.29,0.0,35.99,False,False,No Coupon,"Delivery Mon, Sep 1",None,2025-08-21 11:17:26,0,0.0,2025-09-01,False,False,,Mon,None,0
"iOttie Easy One Touch Signature Dashboard & Windshield Universal Car Mount Phone Holder Desk Stand with Suction Cup Base and Telescopic Arm for iPhone, Samsung, Google, More Smartphones",4.4,139913,10000,18.99,15.84,24.95,False,False,No Coupon,"Delivery Mon, Sep 1",Small Business,2025-08-21 11:17:26,0,0.0,2025-09-01,False,False,,Mon,Small Business,0
"Bose TV Speaker - Soundbar for TV with Bluetooth and HDMI-ARC Connectivity, Black, Includes Remote Control",4.3,12822,3000,,258.0,0.0,False,False,No Coupon,,None,2025-08-21 11:17:26,0,0.0,,False,False,,,None,0
"Samsung EVO Select microSD Memory Card + Adapter, 1TB microSDXC, Up-to 160 MB/s, 4K UHD, UHS-I, C10, U3, V30, A2, for Mobile Phone, Smartphones, Nintendo-Switch, and Tablets (MB-ME1T0SA/AM)",4.7,96854,8000,74.99,73.49,0.0,False,False,No Coupon,"Delivery Mon, Sep 1",None,2025-08-21 11:17:26,0,0.0,2025-09-01,False,False,,Mon,None,0
"Razer Seiren V3 Chroma RGB USB Microphone: Stream & Game Reactive Lighting - Tap-to-Mute Sensor - Condenser Mic - Digital Gain Limiter & Shock Absorber - PC, Discord, OBS Studio, XSplit - Quartz Pink",4.5,171,0,134.39,0.0,0.0,False,True,No Coupon,"Delivery Mon, Sep 1",Manufacturing practices,2025-08-21 11:17:26,0,0.0,2025-09-01,False,False,,Mon,Manufacturing practices,0
"TRANSFORMERS Wearable Bluetooth Speaker Clip On Mini Portable Bluetooth Speaker IPX5 with Mic for Calls and Music 15H Long Playtime Outdoor Suitable Travel Working,Biking,Running,Black Optimus Prime",4.5,28,0,21.99,0.0,0.0,False,True,No Coupon,"Delivery Mon, Sep 1",None,2025-08-21 11:17:26,0,0.0,2025-09-01,False,False,,Mon,None,0
"Lexar 2TB ES3 Portable SSD, Up to 1050MB/s Read & 1000MB/s Write, Compatible with PC & Mac, Tablets, Smartphones, External Solid State Drive, Silver (LES3XXX002T-RNSAU)",4.5,198,200,119.99,0.0,159.99,False,True,No Coupon,"Delivery Mon, Sep 1",None,2025-08-21 11:17:26,0,0.0,2025-09-01,False,False,,Mon,None,0
"CyberPower CP1500AVRLCD3 Intelligent LCD UPS System, 1500VA/900W, 12 Outlets, 2 USB Ports, AVR, Mini Tower, Black",4.5,7846,3000,,174.99,0.0,False,False,No Coupon,,None,2025-08-21 11:17:26,0,0.0,,False,False,,,None,0
"KODAK PIXPRO Friendly Zoom FZ45-BK 16MP Digital Camera with 4X Optical Zoom 27mm Wide Angle and 2.7"" LCD Screen (Black)",4.2,3651,6000,99.99,0.0,129.99,False,False,No Coupon,Delivery Aug 29 - Sep 12,None,2025-08-21 11:17:26,0,0.0,2025-08-29,False,False,,,None,0
"HP 68 Black/Tri-Color Ink Cartridges (2-Pack) | Works Envy 6100e, 6500e Series | Eligible for Instant Ink | 6L6S2TN",4.6,510,7000,50.92,0.0,64.85,False,False,No Coupon,"Delivery Mon, Sep 1",None,2025-08-21 11:17:26,0,0.0,2025-09-01,False,False,,Mon,None,0
"Amazon Basics Adjustable Folding Guitar Stand, A-shape, Fully Assembled - For School Music Program, Concerts & Multiple Users, Black, 8.66 x 15.16 x 3.74 inches",4.8,61748,10000,14.99,14.13,0.0,True,False,No Coupon,"Delivery Mon, Sep 1",None,2025-08-21 11:17:26,0,0.0,2025-09-01,False,False,,Mon,None,0
"Sceptre Curved 27"" FHD 1080p 75Hz LED Monitor HDMI VGA Build-In Speakers, EDGE-LESS Metal Black 2019 (C275W-1920RN)",4.6,14186,4000,92.97,0.0,139.97,False,False,No Coupon,"Delivery Mon, Sep 1",None,2025-08-21 11:17:26,0,0.0,2025-09-01,False,False,,Mon,None,0
"Epson EcoTank Photo ET-8550 Wireless Wide-Format All-in-One Supertank Printer with Scanner, Copier, Ethernet and 4.3-inch Color Touchscreen, Large, White",4.2,1850,1000,,0.0,0.0,False,False,No Coupon,"Delivery Mon, Sep 1",Works with Alexa,2025-08-21 11:17:26,0,0.0,2025-09-01,False,False,,Mon,Works with Alexa,0
"WD_BLACK 2TB SN850X NVMe Internal Gaming SSD Solid State Drive - Gen4 PCIe, M.2 2280, Up to 7,300 MB/s - WDS200T2X0E",4.8,28135,3000,129.99,127.39,189.99,False,False,No Coupon,"Delivery Mon, Sep 1",None,2025-08-21 11:17:26,0,0.0,2025-09-01,False,False,,Mon,None,0
"Kasa Smart Indoor Pan-Tilt Home Security Camera, 1080p HD Dog Camera w/Night Vision, Motion Detection for Baby & Pet Monitor, Cloud & SD Card Storage, Works w/ Alexa & Google Home, 2.4G WiFi (EC71)",4.4,38090,10000,21.99,19.43,24.99,True,False,No Coupon,"Delivery Mon, Sep 1",Works with Alexa,2025-08-21 11:17:26,0,0.0,2025-09-01,False,False,,Mon,Works with Alexa,0
"Brother Genuine TN2294PK Standard Yield 4-Pack Printer Toner Cartridges - Black, Cyan, Magenta, Yellow Toner Multipack",4.5,490,2000,286.99,0.0,0.0,False,False,No Coupon,"Delivery Mon, Sep 1",None,2025-08-21 11:17:26,0,0.0,2025-09-01,False,False,,Mon,None,0
"Skylight Frame – WiFi Digital Picture Frame Customer Support, Touch Screen Digital Photo Frame with Easy Setup, Photo Gifts for Parents and Grandparents - 10 Inch Black",4.7,24816,4000,139.99,0.0,159.0,False,False,No Coupon,"Delivery Mon, Sep 1",None,2025-08-21 11:17:26,0,0.0,2025-09-01,False,False,,Mon,None,0
"Hisense 32-Inch Class A4 Series FHD 1080p Smart Fire TV (32A4NF, 2025 Model) - DTS Virtual: X, Slim Bezel Design, Alexa Built in",4.4,526,4000,97.99,0.0,119.99,False,False,No Coupon,"Delivery Mon, Sep 1",None,2025-08-21 11:17:26,0,0.0,2025-09-01,False,False,,Mon,None,0
"Turtle Beach Stealth 600 Wireless Multiplatform Amplified Gaming Headset for Xbox Series X|S, Xbox One, PC, PS5, PS4, & Mobile – Bluetooth, 80-Hr Battery, Noise-Cancelling Mic – Black",4.3,3340,6000,98.74,49.99,0.0,False,False,No Coupon,"Delivery Mon, Sep 1",None,2025-08-21 11:17:26,0,0.0,2025-09-01,False,False,,Mon,None,0
Escort MAX 360c Radar Detector with Extra Mount & OBDII Cord Bundle,4.4,1465,50,569.95,0.0,0.0,False,True,No Coupon,"Delivery Mon, Sep 1",None,2025-08-21 11:17:26,0,0.0,2025-09-01,False,False,,Mon,None,0
"RCA 10.1"" WiFi Digital Picture Frame Uhale App Photo Frames Electronic HD IPS Touch Screen Display with 32GB Memory LED Lights, Support USB/SD Card, Slideshow, Instantly Share Photos Videos",4.0,5,0,59.99,0.0,79.99,False,True,No Coupon,"Delivery Mon, Sep 1",None,2025-08-21 11:17:26,0,0.0,2025-09-01,False,False,,Mon,None,0
"Fila Smart Watch for Men Women (Answer/Make Calls), 1.95"" Fitness Watch with Heart Rate/Sleep Monitor, Step Counter, Fitness Tracker with 100+ Sports for Android iOS",4.7,63,0,49.99,0.0,79.99,False,True,No Coupon,"Delivery Mon, Sep 1",None,2025-08-21 11:17:26,0,0.0,2025-09-01,False,False,,Mon,None,0
"Energizer MAX AA Batteries (16 Pack), Double A Alkaline Batteries",4.8,172,1000,16.19,0.0,0.0,False,True,No Coupon,"Delivery Mon, Sep 1",None,2025-08-21 11:17:40,0,0.0,2025-09-01,False,False,,Mon,None,0
"Belkin MagSafe-Compatible Charger, 3-in-1 Wireless Charging Station, Qi2-Certified 15W Wireless Charge for Apple iPhone 16 Series, Apple Watch, AirPods w/Non-Slip Base, 40W Included - Black",4.4,3520,1000,119.99,0.0,0.0,False,True,Save 15%  with coupon,"Delivery Mon, Sep 1",None,2025-08-21 11:17:40,15%,0.0,2025-09-01,False,False,,Mon,None,0
"Razer Seiren V3 Chroma RGB USB Microphone: Stream & Game Reactive Lighting - Tap-to-Mute Sensor - Condenser Mic - Digital Gain Limiter & Shock Absorber - PC, Discord, OBS Studio, XSplit - Quartz Pink",4.5,171,0,134.39,0.0,0.0,False,True,No Coupon,"Delivery Mon, Sep 1",Manufacturing practices,2025-08-21 11:17:40,0,0.0,2025-09-01,False,False,,Mon,Manufacturing practices,0
"Canon PGI-280XL/CLI-281 5 Color Pack Compatible to TR8520, TR7520, TS9120 Series,TS8120 Series, TS6120 Series",4.6,10969,6000,,68.45,0.0,False,False,No Coupon,,None,2025-08-21 11:17:40,0,0.0,,False,False,,,None,0
Chuckit! Ultra Ball Dog Toy - Medium Bouncy Fetch Balls For Dogs 20-60 lbs - Made from Durable Rubber - Floating Water Pet Toys - Size Medium - 2.5-inch Diameter - Pack of 2,4.8,125648,10000,,14.99,0.0,True,False,No Coupon,,None,2025-08-21 11:17:40,0,0.0,,False,False,,,None,0
"HP 141A Black Toner Cartridge | Works with HP LaserJet M110 Series, HP LaserJet MFP M139, M140 Series | W1410A | Standard (Pack of 1)",4.6,3376,7000,,61.89,0.0,False,False,No Coupon,,None,2025-08-21 11:17:40,0,0.0,,False,False,,,None,0
"JBL Clip 5 - Ultra-Portable, Waterproof & Dustproof Bluetooth Speaker, Big Pro Sound with Punchy bass, Integrated Carabiner, Up to 12 Hours of Play, Made in Part with Recycled Materials (Black)",4.8,4456,6000,,49.99,0.0,False,False,No Coupon,,Recycled materials,2025-08-21 11:17:40,0,0.0,,False,False,,,Recycled materials,0
"HP DeskJet 4255e Wireless All-in-One Color Inkjet Printer, Scanner, Copier, Best-for-Home, 3 Month Instant Ink Trial Included (588S6A)",3.9,4292,5000,,79.19,0.0,False,False,No Coupon,,Works with Alexa,2025-08-21 11:17:40,0,0.0,,False,False,,,Works with Alexa,0
MSI Gaming GeForce RTX 3060 12GB 15 Gbps GDRR6 192-Bit HDMI/DP PCIe 4 Torx Twin Fan Ampere OC Graphics Card,4.7,4330,3000,,299.99,0.0,False,False,No Coupon,,None,2025-08-21 11:17:40,0,0.0,,False,False,,,None,0
"Kleenex Professional Facial Tissue, Bulk (03076), 2-Ply, White, Flat Boxed Format, Designed for Business, Convenience Size (125 Tissues/Box, 12 Boxes, 1,500 Sheets/Case)",4.5,20721,9000,24.63,24.38,27.99,False,False,No Coupon,"Delivery Mon, Sep 1",None,2025-08-21 11:17:40,0,0.0,2025-09-01,False,False,,Mon,None,0
HP 24mh FHD Computer Monitor with 23.8-Inch IPS Display (1080p) - Built-In Speakers and VESA Mounting - Height/Tilt Adjustment for Ergonomic Viewing - HDMI and DisplayPort - (1D0J9AA#ABA),4.6,25312,2000,,129.79,0.0,False,False,No Coupon,,Energy efficiency +3 more,2025-08-21 11:17:40,0,0.0,,False,False,,,Energy efficiency,3
Ubiquiti Networks UniFi 7 Pro | WiFi 7 Access Point | US Model | PoE+ Adapter not Included (U7-Pro-US),4.6,260,3000,188.0,179.55,0.0,True,False,No Coupon,Delivery Sep 1 - 2,None,2025-08-21 11:17:40,0,0.0,2025-09-01,False,False,,,None,0
"Energizer AAA Batteries, Max Triple A Max Battery Alkaline, 24 Count",4.8,22981,10000,13.99,0.0,21.98,False,False,No Coupon,"Delivery Mon, Sep 1",None,2025-08-21 11:17:40,0,0.0,2025-09-01,False,False,,Mon,None,0
"Amazon Basics 128 GB Ultra Fast USB 3.1 Flash Drive, Black",4.6,26303,10000,14.99,13.45,0.0,False,False,No Coupon,"Delivery Mon, Sep 1",None,2025-08-21 11:17:40,0,0.0,2025-09-01,False,False,,Mon,None,0
"AT&T BL102-2 DECT 6.0 2-Handset Cordless Phone for Home with Answering Machine, Call Blocking, Caller ID Announcer, Audio Assist, Intercom, and Unsurpassed Range, Silver/Black",4.3,30484,7000,49.94,38.99,59.95,True,False,No Coupon,"Delivery Mon, Sep 1",None,2025-08-21 11:17:40,0,0.0,2025-09-01,False,False,,Mon,None,0
"LISEN Retractable Car Charger, 69W USB C Car Accessories Adapter for iPhone 16 USB C Charger Fast Charging,Gifts for Women Men, Travel Essentials, Truck Accessories, for iPhone 16 Pro Max 15 14 13 12",4.6,10222,10000,16.99,0.0,27.99,True,True,No Coupon,"Delivery Mon, Sep 1",None,2025-08-21 11:17:40,0,0.0,2025-09-01,False,False,,Mon,None,0
"Turtle Beach Vulcan II TKL Pro Magnetic Mechanical RGB Gaming Keyboard – Analog Hall-Effect Switches, Adjustable Actuation, Rapid Trigger, Swappable Keycaps, Tenkeyless Design, Anti-Ghosting – White",4.4,139,0,97.99,0.0,149.99,False,True,No Coupon,"Delivery Mon, Sep 1",None,2025-08-21 11:17:40,0,0.0,2025-09-01,False,False,,Mon,None,0
"KODAK 10.1 Inch WiFi Digital Picture Frame with 32GB Storage, Electronic Smart Digital Photo Frame 1280x800 IPS Touch Screen, Auto-Rotate, Share Moments Instantly Gifts for Women Mothers Day Christmas",4.3,812,100,59.99,0.0,0.0,False,True,No Coupon,"Delivery Mon, Sep 1",None,2025-08-21 11:17:40,0,0.0,2025-09-01,False,False,,Mon,None,0
Ring Wired Doorbell Pro (newest model) – Best-in-class with cutting-edge features (existing doorbell wiring required),4.5,10058,4000,,195.49,0.0,False,False,No Coupon,,Works with Alexa,2025-08-21 11:17:40,0,0.0,,False,False,,,Works with Alexa,0
"HP Pavilion 15.6"" HD Touchscreen Anti-Glare Laptop, 16GB RAM, 1TB SSD Storage, Intel Core Processor up to 4.1GHz, Up to 11 Hours Long Battery Life, Type-C, HDMI, Windows 11 Home, Silver",4.2,1353,2000,413.99,309.95,0.0,False,False,No Coupon,"Delivery Mon, Sep 1",None,2025-08-21 11:17:40,0,0.0,2025-09-01,False,False,,Mon,None,0
"TP-Link AC600 USB WiFi Adapter for PC (Archer T2U Plus)- Wireless Network Adapter for Desktop with 2.4GHz, 5GHz High Gain Dual Band 5dBi Antenna, Supports Win11/10/8.1/8/7/XP, Mac OS 10.9-10.14, Black",4.4,40774,10000,14.45,12.45,19.99,True,False,No Coupon,"Delivery Mon, Sep 1",None,2025-08-21 11:17:40,0,0.0,2025-09-01,False,False,,Mon,None,0
"Scotch Thermal Laminator, Extra Wide 13 Inch Input, Ideal for Teachers, Small Offices, or Home (TL1302Z)",4.5,378,5000,59.99,52.86,0.0,False,False,No Coupon,"Delivery Mon, Sep 1",None,2025-08-21 11:17:40,0,0.0,2025-09-01,False,False,,Mon,None,0
"Garmin Forerunner 165, Running Smartwatch, Colorful AMOLED Display, Training Metrics and Recovery Insights, Black",4.7,1224,3000,249.0,0.0,0.0,False,False,No Coupon,"Delivery Mon, Sep 1",None,2025-08-21 11:17:40,0,0.0,2025-09-01,False,False,,Mon,None,0
"Razer BlackShark V2 X Gaming Headset: 7.1 Surround Sound - 50mm Drivers - Memory Foam Cushion - For PC, PS4, PS5, Switch - 3.5mm Audio Jack - Black",4.4,22791,8000,39.98,34.53,59.99,False,False,No Coupon,"Delivery Mon, Sep 1",Manufacturing practices,2025-08-21 11:17:40,0,0.0,2025-09-01,False,False,,Mon,Manufacturing practices,0
"SanDisk 512GB Ultra USB 3.0 Flash Drive - SDCZ48-512G-G46, Black",4.7,47889,8000,33.99,28.58,0.0,False,False,No Coupon,"Delivery Mon, Sep 1",None,2025-08-21 11:17:40,0,0.0,2025-09-01,False,False,,Mon,None,0
"HP 951 Cyan, Magenta, Yellow Ink Cartridges (3 pack)| Works with HP OfficeJet 8600, HP OfficeJet Pro 251dw, 276dw, 8100, 8610, 8620, 8630 Series | Eligible for Instant Ink | CR314FN, Combo 3-Pack",4.6,17904,5000,,95.89,0.0,False,False,No Coupon,,None,2025-08-21 11:17:40,0,0.0,,False,False,,,None,0
"Samsung Galaxy Buds FE True Wireless Bluetooth Earbuds, Comfort and Secure in Ear Fit, Auto Switch Audio, Touch Control, Built-in Voice Assistant, Graphite [US Version, 1Yr Manufacturer Warranty]",4.3,6199,5000,69.99,65.23,99.99,False,False,No Coupon,"Delivery Mon, Sep 1",None,2025-08-21 11:17:40,0,0.0,2025-09-01,False,False,,Mon,None,0
"Texas Instruments TI-83 Plus Graphing Calculator, Gray, Standard",4.6,7948,4000,,28.99,0.0,False,False,No Coupon,,None,2025-08-21 11:17:40,0,0.0,,False,False,,,None,0
"JBL Go 4 - Ultra-Portable, Waterproof and Dustproof Bluetooth Speaker, Big Pro Sound with Punchy bass, 7-Hour Built-in Battery, Made in Part with Recycled Materials (Black)",4.8,7882,7000,,44.95,0.0,False,False,No Coupon,,Recycled materials,2025-08-21 11:17:40,0,0.0,,False,False,,,Recycled materials,0
"Samsung SmartTag2 (2023) Bluetooth + UWB, IP67 Water and Dust Resistant, Findable via App, 1.5 Year Battery Life (4-Pack) - Black/White (Global Edition, No US Warranty)",4.5,5068,7000,55.14,54.62,0.0,False,False,No Coupon,"Delivery Mon, Sep 1",None,2025-08-21 11:17:40,0,0.0,2025-09-01,False,False,,Mon,None,0
"Duracell Coppertop 9V Battery, 6 Count (Pack of 1), 9 Volt Battery with Long-lasting Power, All-Purpose Alkaline 9V Battery for Household and Office Devices",4.8,5207,20000,25.47,0.0,0.0,False,True,No Coupon,"Delivery Mon, Sep 1",None,2025-08-21 11:17:40,0,0.0,2025-09-01,False,False,,Mon,None,0
"Fila Smart Watch for Men Women (Answer/Make Calls), 1.95"" Fitness Watch with Heart Rate/Sleep Monitor, Step Counter, Fitness Tracker with 100+ Sports for Android iOS",4.7,63,0,49.99,0.0,79.99,False,True,No Coupon,"Delivery Mon, Sep 1",None,2025-08-21 11:17:40,0,0.0,2025-09-01,False,False,,Mon,None,0
"Sanus Height Adjustable Speaker Stand for Sonos Era 300™ - 17"" Height Adjustment Sonos Stand Includes Carpet Spikes & Rubber Pads - Easy DIY Install Comes w/All Hardware - White",4.4,45,0,179.99,0.0,0.0,False,True,No Coupon,"Delivery Mon, Sep 1",None,2025-08-21 11:17:40,0,0.0,2025-09-01,False,False,,Mon,None,0
"KODAK 10.1 Inch WiFi Digital Picture Frame,1280x800 HD IPS Touch Screen, Electronic Smart Photo Frame with 32 GB Memory, Auto-Rotate, Instantly Share Photos/Videos Anywhere",4.1,264,0,85.99,0.0,0.0,False,True,Save $16.00  with coupon,"Delivery Mon, Sep 1",None,2025-08-21 11:17:53,$16.00,0.0,2025-09-01,False,False,,Mon,None,0
"Sanus Height Adjustable Speaker Stand for Sonos Era 300™ - 17"" Height Adjustment Sonos Stand Includes Carpet Spikes & Rubber Pads - Easy DIY Install Comes w/All Hardware - White",4.4,45,0,179.99,0.0,0.0,False,True,No Coupon,"Delivery Mon, Sep 1",None,2025-08-21 11:17:53,0,0.0,2025-09-01,False,False,,Mon,None,0
"Legrand Wiremold RDSZCBK radiant Furniture Power Center with USB and Switch, Recessed Power Strip, 2 Outlets, Type A/C USB, 6 Foot Cord, Black",4.9,9,0,97.2,0.0,139.09,False,True,No Coupon,"Delivery Mon, Sep 1",None,2025-08-21 11:17:53,0,0.0,2025-09-01,False,False,,Mon,None,0
"Fujifilm QuickSnap Flash 400 One Time Use 35mm Camera with Flash, 27 Exposures, 4-Pack",4.6,380,5000,68.88,0.0,76.89,False,False,No Coupon,"Delivery Mon, Sep 1",None,2025-08-21 11:17:53,0,0.0,2025-09-01,False,False,,Mon,None,0
"Amazon Basics 4-Pack 23A Alkaline Battery, 12 Volt, Long-Lasting Power",4.7,34376,20000,5.59,0.0,0.0,False,False,No Coupon,"Delivery Mon, Sep 1",None,2025-08-21 11:17:53,0,0.0,2025-09-01,False,False,,Mon,None,0
